{
  "schemaVersion": "0.2",
  "algorithm": "sha256-chain-v1",
  "signerKeyId": "kid:tasc-ta2-uas-small",
  "signature": "hQ9pwuVJuFTuS6EnOqsir8ipIO+AMjNsKXIfCgCmwkx8C6N08smGE9dgfE2OM9odGhX59s5AtvVderbcaVgrxrJqKY4gGtRYlHsQr12nc5hMLDTWgJwpARGAmNvJtPGYnqUbgBsUj/dV+HZZBhxCgbQyFKQtz5RtoqP4H7kSofYmsRnm4oBXIlKmrSJ1WhPsezXru2n6Yk9SMhPdiC+AVKaSOYU56IDp/JLxtgzLzcg7KrBuzFx2ojoCSAmMRwXcHr027HaCZdfuyq9PHxY8R2RFbG5JN+bESuQBHsrDyYRbFBNSZF2QlQHE/eRuNkOx81VA2tFST2f5E6//4ZA+SA==",
  "signatureAlgorithm": "rsa-sha256",
  "signatureEncoding": "base64",
  "signingTimeUtc": "2026-02-13T07:04:00Z",
  "signerCertificatePath": "evidence/manifests/pkcs11-signer-cert-uas-small.pem",
  "certificateChainPath": "evidence/manifests/pkcs11-chain-uas-small.pem",
  "trustRootsDigest": "sha256:f6181af04c753df4b126eda060d194f3f48962784430c04bf7e549520ce69500",
  "keySource": "PKCS11",
  "root": "sha256:3511e71c0a4c216c1b529242a3fae3e458ccff9a54db5ac0338ecf4541326385",
  "events": [
    {
      "seq": 1,
      "tickMs": 0,
      "eventType": "mode_switch",
      "payloadDigest": "sha256:657cd6839d0a5a45bed968254f07d45b6fdbae19783c2eddc1d824ec1b8c44d6",
      "prevHash": "",
      "hash": "sha256:384c0145c24bb09e4ec1480864792736934670d80b6f3dd7d6595d737ef81dfa"
    },
    {
      "seq": 2,
      "tickMs": 20,
      "eventType": "heartbeat",
      "payloadDigest": "sha256:6642dea6260c9bd52fb89df81a72bbbc77719989ff66e10223e24fd8e0fa4ce4",
      "prevHash": "sha256:384c0145c24bb09e4ec1480864792736934670d80b6f3dd7d6595d737ef81dfa",
      "hash": "sha256:f0fd3bafbde3f22912989a0689fd3059f4c0bbe99b4adc7d4b69000384fa33e7"
    },
    {
      "seq": 3,
      "tickMs": 40,
      "eventType": "guard_eval",
      "payloadDigest": "sha256:ae433022bb37c1f2911c6f675b369a4ba09418d1a98164e1d3765953c7c49a91",
      "prevHash": "sha256:f0fd3bafbde3f22912989a0689fd3059f4c0bbe99b4adc7d4b69000384fa33e7",
      "hash": "sha256:3511e71c0a4c216c1b529242a3fae3e458ccff9a54db5ac0338ecf4541326385"
    }
  ]
}
