{
  "schemaVersion": "0.2",
  "algorithm": "sha256-chain-v1",
  "signerKeyId": "kid:tasc-ta2-hybrid-vtol",
  "signature": "1hszbI0Y9sm6qt/0Hq35QwglAmBZely+W/R3tybuFgVYpfcdlDX2RsOr/W4aOQvHMgKdi1xQR0fZKfnPgfaEO/X7J89M5MrPLIqFWk1maQQH6gahE/s22eVpyjaKdBkl6lhzaVfvZ6Q37qYTAtH2uxMR0wQJKILp6DJFQLi8iMZjoL4EUlHfF6sRp1kKNdYaB/8OYep6S3kQgYvpu9rivyBFTcOOjeNT/07To1qaGppYtFRGway4vOVSnENUcorSHUkBDfd+enjuOY1fCD5lUxA5wFxw4EdUTgeJ/+4ph+/N1YQOBhp3GWgpaCgL5mGu7VjzWB2yxlmHWmbomguezQ==",
  "signatureAlgorithm": "rsa-sha256",
  "signatureEncoding": "base64",
  "signingTimeUtc": "2026-02-11T19:27:25Z",
  "signerCertificatePath": "policies/attestation/pki/ta2-signer.cert.pem",
  "certificateChainPath": "policies/attestation/pki/ta2-chain.pem",
  "trustRootsDigest": "sha256:f6181af04c753df4b126eda060d194f3f48962784430c04bf7e549520ce69500",
  "keySource": "PKCS11",
  "root": "sha256:202c3ceaad6945c3338395de7cfd866155c1e2eebe50c0b87bdcc4cef4ac038d",
  "events": [
    {
      "seq": 1,
      "tickMs": 0,
      "eventType": "mode_switch",
      "payloadDigest": "sha256:0ec9cb98e122cfb451cdc083d992538367e309fb680a1be5edc5b69a29301c08",
      "prevHash": "",
      "hash": "sha256:88f94b057bc93ec091369381da78284081b5904adbc20958b201b49be07373c7"
    },
    {
      "seq": 2,
      "tickMs": 20,
      "eventType": "heartbeat",
      "payloadDigest": "sha256:7e8996e446f143c9eabbe14530f493d3a6ab9c08c5e702cce9bb4931bdbeb3ea",
      "prevHash": "sha256:88f94b057bc93ec091369381da78284081b5904adbc20958b201b49be07373c7",
      "hash": "sha256:aa45c4ae47b4b271e6d8f9897aacbe350dbe8427e949c81b81377d103ee583db"
    },
    {
      "seq": 3,
      "tickMs": 40,
      "eventType": "guard_eval",
      "payloadDigest": "sha256:d0242023c7d1d810980809994cd9e08800b2bed0d454cd197fb4672cf6969a1a",
      "prevHash": "sha256:aa45c4ae47b4b271e6d8f9897aacbe350dbe8427e949c81b81377d103ee583db",
      "hash": "sha256:202c3ceaad6945c3338395de7cfd866155c1e2eebe50c0b87bdcc4cef4ac038d"
    }
  ]
}
